{
  "EventId": "e_myc_13",
  "EventName": "The Assimilated Merchant",
  "Description": "A squat figure sits behind a makeshift counter of mushroom-wood, wares spread before him on fungal cloth. As you approach, you see it is a dwarf, but mushrooms sprout from his shoulders and neck, their caps pulsing faintly. He speaks in two voices at once: his own, and something deeper.",
  "DescriptionAction": "What do you do?",
  "SpriteSource": "",
  "EventTier": "T0",
  "ReplyRandom": 0,
  "RequirementId": "",
  "Replies": [
    {
      "ReplyText": "Trade with the merchant.",
      "Action": 46,
      "SsShopId": "myc_merchant",
      "SsDiscount": 20,
      "SsText": "The merchant grins with too many teeth. His wares are surprisingly good: salvaged gear and rare fungi, offered at prices that seem almost generous. Perhaps the Mycelium wants you well-equipped for what lies ahead.",
      "SsMerchantUI": true
    },
    {
      "ReplyText": "Try to free the dwarf from the fungal infection.",
      "Action": 54,
      "HasRoll": true,
      "SsGold": 50,
      "FlText": "Your attempt to remove the fungus triggers a violent reaction. The dwarf's eyes go dark as the Mycelium takes full control, and he lunges at you with inhuman strength.",
      "SsXP": 40,
      "SsText": "With combined effort, you pry the fungal growths from the dwarf's body. He gasps, suddenly speaking in only one voice, and presses a reward into your hands with trembling fingers. \"There is a sealed vault in the old laboratory. I know the way in.\"",
      "RollDC": 1,
      "SsRequirementUnlockId": "myc_dwarf_freed",
      "FlCombatId": "emyc_13a",
      "RepeatForAllMages": true,
      "RollTarget": 3,
      "RollMode": 1
    },
    {
      "ReplyText": "Leave him be.",
      "Action": 11,
      "SsText": "You back away slowly. Some things are better left alone in these depths. The merchant watches you go, both voices humming the same sad tune.",
      "SsXP": 20
    }
  ]
}