{
  "EventId": "e_aquar36_a",
  "EventName": "",
  "Description": "",
  "DescriptionAction": "",
  "SpriteSource": "",
  "EventTier": "T0",
  "ReplyRandom": 0,
  "RequirementId": "",
  "AppendReplies": true,
  "Replies": [
    {
      "ReplyText": "Cross the pale portal, from which a damp, earthy warmth comes out.",
      "Action": 29,
      "SsText": "You step through the shimmering wall. Spores fall away like ash, and the world rearranges itself around you.",
      "SsHealPercent": 100.0,
      "SsNodeTravelId": "myc_0",
      "SsRequirementUnlockId": "_tier2"
    }
  ]
}