{
  "EventId": "e_myc_11",
  "EventName": "The Cleansing Chamber",
  "Description": "Water trickles through a ring of ancient stone basins, each one lined with pale moss that filters the spores from the air. Someone built this place as a refuge a long time ago, and it still works.",
  "DescriptionAction": "What do you do?",
  "SpriteSource": "",
  "EventTier": "T0",
  "ReplyRandom": 0,
  "RequirementId": "",
  "Replies": [
    {
      "ReplyText": "Pay the shrine tithe and bathe in the basins.",
      "Action": 27,
      "GoldCost": 80,
      "SsText": "The cold water washes the spores from your wounds. You emerge refreshed and whole.",
      "SsHealPercent": 60.0
    },
    {
      "ReplyText": "Boil the moss into a restorative tonic.",
      "Action": 42,
      "HasRoll": true,
      "RollDC": 1,
      "SsText": "The tonic comes out clear and potent. You bottle several doses for later.",
      "SsXP": 20,
      "SsLootId": "myc_forage",
      "FlText": "The brew boils over, scalding the party.",
      "FlHealFlat": -12,
      "RollMode": 1
    },
    {
      "ReplyText": "Rest by the water.",
      "Action": 20,
      "SsText": "You rest for a while, listening to the dripping water. It is peaceful.",
      "SsHealPercent": 15.0
    }
  ]
}