{
  "EventId": "e_myc_6",
  "EventName": "The Luminous Garden",
  "Description": "A vast cavern opens before you, its ceiling lost in darkness. Bioluminescent mushrooms of every color carpet the floor, and a crystalline spring bubbles at the center, its water glowing a soft, inviting blue.",
  "DescriptionAction": "What do you do?",
  "SpriteSource": "",
  "EventTier": "T0",
  "ReplyRandom": 0,
  "RequirementId": "",
  "Replies": [
    {
      "ReplyText": "Drink from the crystalline spring.",
      "Action": 30,
      "FlText": "The water tastes sweet, then wrong. The mushrooms around you turn toward you in unison, and the garden attacks.",
      "SsHealPercent": 20,
      "FlCombatId": "emyc_6a",
      "HasRoll": true,
      "RollDC": 2,
      "SsText": "The water is cold and impossibly clean. Warmth spreads through your body and your wounds knit closed.",
      "SsXP": 30
    },
    {
      "ReplyText": "Harvest the glowing mushrooms.",
      "Action": 14,
      "SsText": "You carefully pick the safest-looking caps and bundle them away. Some may even be edible.",
      "SsLootId": "myc_forage"
    },
    {
      "ReplyText": "Purify the water with healing magic.",
      "Action": 39,
      "FlText": "The spores fight back, lashing out with stinging tendrils before you can finish the ritual.",
      "SsHealPercent": 30,
      "FlHealFlat": -10,
      "HasRoll": true,
      "RollDC": 1,
      "SsText": "Your magic sweeps the spring clean of spores. The pure water restores the whole party.",
      "SsXP": 20,
      "RepeatForAllMages": true,
      "RollTarget": 3
    },
    {
      "ReplyText": "Follow the glowing thread to its source.",
      "Action": 45,
      "SsXP": 30,
      "SsLootId": "myc_lichenden",
      "FlHealFlat": -15,
      "HasRoll": true,
      "RollDC": 1,
      "RollTarget": 3,
      "RepeatForAllScouts": true,
      "SsText": "The thread ends in a soft, lichen-furred creature. It leans against your leg as if it had always been there.",
      "FlText": "You lose the thread in the dark and bruise yourself on the roots.",
      "RollMode": 1
    }
  ]
}