{
  "EventId": "e_myc_24",
  "EventName": "The Hivemind Nexus",
  "Description": "The passage widens into a pulsing organic chamber. At its center, a massive fungal brain, easily the size of a house, hangs suspended by thousands of tendrils. Every strand twitches in time with a rhythm you can feel in your teeth.",
  "DescriptionAction": "What do you do?",
  "SpriteSource": "",
  "EventTier": "T0",
  "ReplyRandom": 0,
  "RequirementId": "",
  "Replies": [
    {
      "ReplyText": "Attempt to commune with the hivemind.",
      "Action": 51,
      "FlText": "The hivemind recoils from your touch, lashing out with a wave of agony.",
      "SsXP": 50,
      "FlHealFlat": -20,
      "HasRoll": true,
      "RollDC": 3,
      "SsText": "The hivemind opens to you, and you glimpse the shape of the Mycelarch. A tithe of the hive's memory settles into your mind, as a gift.",
      "SsRewardTier": "5",
      "RepeatForAllMages": true,
      "RollTarget": 3
    },
    {
      "ReplyText": "Attack the nexus directly.",
      "Action": 2,
      "SsText": "The nexus screams and the hive answers.",
      "SsCombatId": "emyc_24a"
    },
    {
      "ReplyText": "Sever the tendrils.",
      "Action": 23,
      "FlText": "The tendrils thrash and the nexus screams, drawing the hive down on your heads.",
      "SsLootId": "myc_forage",
      "FlCombatId": "emyc_24b",
      "HasRoll": true,
      "RollDC": 3,
      "SsText": "You hack the tendrils apart and the nexus goes still. Its drained reservoirs pour out as a glistening treasure.",
      "SsXP": 30,
      "RepeatForAllWarriors": true,
      "RollTarget": 3
    }
  ]
}