{
  "EventId": "e_myc_15",
  "EventName": "The Spore Shaft",
  "Description": "A vertical shaft plunges through the cavern floor, its walls crusted with crystallized spores that glitter in the dark. Warm air rises from below, carrying a faint, rhythmic hum.",
  "DescriptionAction": "How do you proceed?",
  "SpriteSource": "",
  "EventTier": "T0",
  "ReplyRandom": 0,
  "RequirementId": "",
  "Replies": [
    {
      "ReplyText": "Descend the rope ladder.",
      "Action": 40,
      "FlText": "The rope snaps mid-climb. You drop the last stretch and land hard.",
      "SsGold": 40,
      "FlHealFlat": -20,
      "HasRoll": true,
      "RollDC": 2,
      "SsText": "The rope holds. At the bottom you find the remains of a previous expedition, and a little of their gear is still good.",
      "SsXP": 30,
      "RepeatForAllWarriors": true,
      "RollTarget": 3
    },
    {
      "ReplyText": "Seal the shaft with magic.",
      "Action": 30,
      "FlText": "The shaft convulses and the spores answer with a brood of hungry things.",
      "HasRoll": true,
      "SsText": "The spore vents fall silent. The crystal growths dull and the air clears.",
      "SsXP": 50,
      "RollDC": 2,
      "FlCombatId": "emyc_15a",
      "RepeatForAllMages": true,
      "RollTarget": 3
    },
    {
      "ReplyText": "Collect the crystallized spore dust.",
      "Action": 27,
      "SsDust": 60,
      "SsXP": 30,
      "SsText": "You pay a scavenger crew for the right to scrape the shaft walls clean. The dust fetches a fine price among alchemists.",
      "GoldCost": 100
    }
  ]
}