{
  "EventId": "e_myc_9",
  "EventName": "The Sealed Alcove",
  "Description": "A pocket of clean air hangs inside a sealed alcove, the walls scraped smooth of fungus. An explorer is slumped against the far wall, his pack still strapped to his back and a journal clutched in his hand. Pale threads pulse faintly beneath his collar. Whatever took him did not finish the job.",
  "DescriptionAction": "What do you do?",
  "SpriteSource": "",
  "EventTier": "T0",
  "ReplyRandom": 0,
  "RequirementId": "",
  "Replies": [
    {
      "ReplyText": "Search the explorer's pack.",
      "Action": 12,
      "SsLootId": "myc_forage",
      "SsText": "The pack holds a few well-preserved supplies and a handful of coins.",
      "SsGold": 30
    },
    {
      "ReplyText": "Rest in the clean air.",
      "Action": 20,
      "SsText": "For the first time since the descent you breathe freely. The party rests and recovers.",
      "SsHealPercent": 25
    },
    {
      "ReplyText": "Read the journal.",
      "Action": 53,
      "SsText": "The journal records the explorer's descent and a warning: the Mycelarch sits at the hive's core, and beyond its throne an old obelisk still hums - the only way out.",
      "SsXP": 45
    }
  ]
}